source_name,source_group,url,title,published,commodity,event_type,sentiment,sentiment_score,analysis,impact,outlook,alert_score,alert_severity,alert_tags
GrainCentral_Australia,grains,https://www.graincentral.com/news/shoalhaven-starches-directed-to-fund-projects-after-silo-collapse/,EPA orders Manildra arm to fund projects after 2024 silo collapse,2026-03-17T05:43:48+00:00,other,politics,neutral,0,"L'entreprise Manildra Group, productrice de Amidon, doit payer plus de 170 000 dollars pour des projets communautaires et environnementaux. Cet événement n'a pas d'impact direct sur les prix des matières premières agricoles. Les traders doivent surveiller les événements politiques et réglementaires pouvant affecter les entreprises agroalimentaires.",Aucun impact direct sur les prix,Stable à court terme,1,none,
GrainCentral_Australia,grains,https://www.graincentral.com/markets/fertiliser-fiasco-kindles-food-for-thought/,Fertiliser fiasco kindles food for thought,2026-03-17T00:05:49+00:00,other,politics,bullish,1,"La pénurie de fertilisants et de gaz due au conflit entre les forces iraniennes et américano-israéliennes pourrait entraîner une augmentation des coûts de production pour les agriculteurs, ce qui pourrait avoir un impact haussier sur les prix des denrées alimentaires. Les traders devraient surveiller de près l'évolution de la situation pour anticiper les mouvements de prix. Les prix des denrées alimentaires pourraient augmenter à court terme en raison de la pénurie de fertilisants.",Impact haussier court terme de +2-4% sur les prix des denrées alimentaires,Perspective haussière pour les prix des denrées alimentaires dans les 1-2 semaines à venir,4,watch,conflict
GrainCentral_Australia,grains,https://www.graincentral.com/weather/bom-weekly-rainfall-update-17-march-2026-outlook/,BOM weekly rainfall update 17 March 2026 + outlook,2026-03-17T05:31:06+00:00,wheat,weather,bearish,-1,"Les précipitations attendues dans les régions productrices de grains en Australie pourraient entraîner une augmentation des rendements et une meilleure qualité des récoltes, ce qui pourrait exercer une pression à la baisse sur les prix. Les traders devraient surveiller de près les conditions météorologiques et ajuster leurs stratégies en conséquence. Les prix pourraient baisser à court terme en raison de l'augmentation de l'offre.","Impact négatif sur les prix, -2-3% baissier court terme","Perspective baissière pour les prix à court terme, avec un potentiel de rebond si les conditions météorologiques s'améliorent",2,info,
GrainCentral_Australia,grains,https://www.graincentral.com/markets/australias-jan-barley-sorghum-exports-both-up-16pc/,Australia’s Jan barley sorghum exports both up 16pc,2026-03-16T22:22:41+00:00,other,trade,bullish,1,"L'exportation record de barley en janvier en Australie pourrait entraîner une augmentation de la demande pour les autres céréales, ce qui pourrait avoir un impact positif sur les prix. Les traders pourraient profiter de cette tendance haussière à court terme. Cependant, il est important de surveiller les données de production et de stock pour anticiper les mouvements de prix futurs.","L'impact direct sur les prix pourrait être une augmentation de 2-4% à court terme, en raison de la forte demande et de la faible offre.","Les prix pourraient rester haussiers dans les prochaines semaines, en raison de la forte demande et de la faible offre, mais il est important de surveiller les données de production et de stock pour anticiper les mouvements de prix futurs.",2,info,
GrainCentral_Australia,grains,https://www.graincentral.com/news/wa-plant-to-produce-2-3mt-of-urea-from-mid-2027/,WA plant to produce 2.3Mt of urea from mid-2027,2026-03-16T02:29:41+00:00,other,production,bullish,1,"La production d'urée à partir de 2027 pourrait avoir un impact sur les prix des engrais, ce qui pourrait à son tour influencer les coûts de production pour les agriculteurs. Cela pourrait entraîner une augmentation des prix des produits agricoles. L'impact sur les prix sera probablement limité aux engrais et aux produits agricoles qui en dépendent.","L'impact direct sur les prix sera probablement faible, mais pourrait atteindre +1-2% haussier à court terme pour les engrais.",Les prix des engrais et des produits agricoles pourraient rester stables à haussiers dans les prochaines semaines en raison de cette annonce.,3,info,conflict
GrainCentral_Australia,grains,https://www.graincentral.com/news/fertiliser-situation-to-become-better-known-by-end-march/,Fertiliser situation to become clearer by end of March,2026-03-16T05:31:30+00:00,other,logistics,neutral,0,"La situation des fertilisants devrait devenir plus claire d'ici la fin mars, ce qui pourrait avoir un impact sur les plans de plantation des agriculteurs. Les importateurs cherchant à diversifier leurs sources d'approvisionnement pourraient influencer les prix des matières premières agricoles. Cependant, l'impact direct sur les prix des grains n'est pas clair à ce stade.","Aucun impact direct sur les prix des grains pour le moment, mais une possible hausse des coûts de production à moyen terme.","Les prix des grains pourraient rester stables à court terme, mais une surveillance étroite de la situation des fertilisants est nécessaire pour anticiper les éventuels changements de tendance.",1,none,
GrainCentral_Australia,grains,https://www.graincentral.com/news/afc-rm-williams-plan-to-boost-domestic-textile-sector/,"AFC, RMW reveal plan to boost domestic textile sector",2026-03-16T03:52:30+00:00,other,politics,neutral,0,Le texte concerne le secteur textile australien et les plans pour booster le traitement sur place du coton et de la laine grasse. Cela n'a pas d'impact direct sur les marchés des céréales. Les traders de matières premières agricoles doivent surveiller les développements dans d'autres secteurs pour anticiper les tendances futures.,Aucun impact direct sur les prix des céréales.,Les prix des céréales devraient rester stables à court terme en l'absence de facteurs de marché significatifs.,1,none,
GrainCentral_Australia,grains,https://www.graincentral.com/property/darling-downs-portfolio-winds-up-with-auction/,Darling Downs Portfolio winds up with auction,2026-03-15T22:59:24+00:00,other,trade,neutral,0,"La vente des parcelles de la One Tree Portfolio à des acheteurs locaux pour un prix moyen de 10 812 $/ha dans le district de Jandowae pourrait indiquer une stabilité des prix fonciers dans la région. Cependant, cela n'a pas d'impact direct sur les prix des matières premières agricoles. Les traders devraient surveiller les tendances du marché et les facteurs fondamentaux pour prendre des décisions éclairées.",Aucun impact direct sur les prix des matières premières agricoles.,"Les prix des matières premières agricoles devraient rester stables à court terme, en attendant des développements significatifs sur le marché.",1,none,
GrainCentral_Australia,grains,https://www.graincentral.com/news/funding-boost-to-drive-innovation-in-cotton-industry/,Funding boost to drive innovation in cotton industry,2026-03-16T02:07:45+00:00,other,other,neutral,0,"Le texte concerne l'industrie du coton et non les céréales, donc pas d'impact direct sur les prix des grains. Les projets financés visent à réduire l'utilisation de pesticides, à optimiser l'utilisation de l'azote et à mieux gérer les mauvaises herbes dans le coton.","Aucun impact direct sur les prix des grains, mais une potentialité d'innovation dans l'agriculture en général.",Pas de changement prévu dans les prix des grains à court terme en raison de cette information.,0,none,
GrainCentral_Australia,grains,https://www.graincentral.com/markets/daily-market-wire-17-march-2026/,Daily Market Wire 17 March 2026,2026-03-16T23:15:23+00:00,wheat,trade,bearish,-1,"Le marché des céréales secondaires est touché par la baisse, notamment le blé et les céréales grossières. Les prix élevés des céréales livrées ont un impact négatif sur le marché. La tendance baissière pourrait se poursuivre dans les prochains jours.","La baisse pourrait atteindre 2-4% à court terme, ce qui pourrait avoir un impact négatif sur les prix.",Les prix pourraient rester sous pression dans les deux semaines à venir en raison de la tendance baissière actuelle.,2,info,
FarmProgress_US,grains,https://www.farmprogress.com/farm-business/corned-beef-and-cabbage-an-american-tradition-not-irish,"Corned beef and cabbage: An American tradition, not Irish",2026-03-17T08:00:00+00:00,other,other,neutral,0,"Le texte ne fournit aucune information pertinente pour les marchés des matières premières agricoles. Il s'agit d'une discussion sur les origines d'un plat traditionnel américain, sans lien avec les prix ou la production des grains.",Aucun impact direct sur les prix des grains.,Pas de perspective significative pour les prix des grains dans les prochaines semaines en fonction de ce texte.,0,none,
FarmProgress_US,grains,https://www.farmprogress.com/livestock/meeks-farm-innovative-crops-feed-more-cattle,Meeks Farm: Innovative crops feed more cattle,2026-03-17T06:01:00+00:00,other,production,neutral,0,"L'expansion de l'élevage de bovins peut avoir un impact indirect sur la demande de fourrage, mais cela n'affecte pas directement les prix des céréales. Les informations fournies ne sont pas suffisantes pour établir un lien direct avec les marchés des grains. L'impact sur les prix des céréales est donc neutre.",Aucun impact direct sur les prix des céréales.,"Les prix des céréales devraient rester stables dans les prochaines semaines, en l'absence d'informations significatives liées à la production ou à la demande.",0,none,
FarmProgress_US,grains,https://www.farmprogress.com/farm-business/chapter-12-bankruptcies-surge-arkansas-leads-the-way,Chapter 12 bankruptcies surge; Arkansas leads the way,2026-03-17T06:00:00+00:00,other,politics,neutral,0,"Le texte ne fournit pas d'informations spécifiques sur les marchés des grains, mais évoque une crise économique qui pourrait avoir des répercussions sur les marchés agricoles. Les Chapter 12 bankruptcies pourraient indiquer des difficultés financières pour les agriculteurs. Cependant, sans informations plus précises, il est difficile de déterminer l'impact sur les prix.",Aucun impact direct sur les prix n'est mentionné dans le texte.,"Les prix devraient rester stables à court terme, en attendant des informations plus précises sur l'impact de la crise économique sur les marchés agricoles.",1,none,
FarmProgress_US,grains,https://www.farmprogress.com/crop-protection/friend-or-foe-tips-for-crop-scouting-in-conservation-systems,Friend or foe? Tips for crop scouting in conservation systems,2026-03-17T06:00:00+00:00,other,other,neutral,0,"Le texte ne fournit pas d'informations directes sur les marchés des matières premières agricoles. Il traite de la gestion des cultures et de la biologie du sol dans les systèmes de conservation, sans lien direct avec les prix ou la production des grains.",Aucun impact direct sur les prix des grains.,"Les prix des grains devraient continuer à être influencés par les facteurs fondamentaux tels que la météo, les stocks et la demande.",0,none,
FarmProgress_US,grains,https://www.farmprogress.com/names-in-the-news/ben-sklarczyk-named-national-potato-council-president,Ben Sklarczyk takes helm at National Potato Council,2026-03-17T06:00:00+00:00,other,politics,neutral,0,"Le texte ne concerne pas directement les marchés des grains, mais plutôt les pommes de terre. Cependant, les priorités du nouveau président du National Potato Council, notamment l'expansion des marchés d'exportation et la promotion de la durabilité, pourraient avoir un impact indirect sur les marchés agricoles dans leur ensemble. Les traders devraient surveiller les évolutions dans ce secteur pour anticiper les possibles répercussions sur les prix.","Aucun impact direct sur les prix des grains, mais des répercussions potentielles sur les marchés agricoles dans leur ensemble.","Stable à court terme, avec une surveillance accrue des évolutions dans le secteur des pommes de terre et leurs possibles répercussions sur les marchés des grains.",1,none,
FarmProgress_US,grains,https://www.farmprogress.com/farm-business-planning/how-to-manage-financial-stress-on-the-farm,How to manage financial stress on the farm,2026-03-17T06:00:00+00:00,other,other,neutral,0,Le texte ne fournit pas d'informations spécifiques sur les marchés agricoles ou les prix des grains. Il se concentre sur la gestion du stress financier pour les agriculteurs pendant les périodes de récession économique. Cette information n'a pas d'impact direct sur les prix des matières premières agricoles.,Aucun impact direct sur les prix des grains.,Les prix des grains devraient rester stables à court terme en l'absence d'informations spécifiques sur les marchés agricoles.,0,none,
FarmProgress_US,grains,https://www.farmprogress.com/names-in-the-news/managing-the-details-paying-off-for-sandagers,Managing the details paying off for Sandagers,2026-03-17T06:00:00+00:00,other,other,neutral,0,Le texte ne fournit pas d'informations spécifiques sur les marchés agricoles ou les prix des grains. Il décrit l'histoire d'un agriculteur et son approche de l'agriculture. Il n'y a pas d'éléments concrets pour évaluer l'impact sur les prix.,Aucun impact direct sur les prix,Pas de perspective claire pour les prix,0,none,
FarmProgress_US,grains,https://www.farmprogress.com/soil-health/livestock-manure-can-bolster-soil-health-and-microbes,Livestock manure can bolster soil health and microbes,2026-03-17T06:00:00+00:00,other,other,neutral,0,"Le texte ne fournit pas d'informations directes sur les marchés des matières premières agricoles, mais souligne l'importance de la gestion des déchets de bétail pour la santé des sols et la production des cultures. Cela pourrait avoir un impact indirect sur la production agricole en général. Les traders devraient surveiller les tendances dans les secteurs connexes pour identifier les opportunités de trading.","Aucun impact direct sur les prix des matières premières agricoles, mais une gestion efficace des déchets de bétail pourrait contribuer à une production agricole plus durable à long terme.","Les prix des matières premières agricoles devraient rester stables à court terme, mais les traders devraient être attentifs aux développements dans les secteurs connexes pour identifier les opportunités de trading à long terme.",0,none,
FarmProgress_US,grains,https://www.farmprogress.com/farm-business/fsa-payment-rules-make-llcs-a-great-option,FSA payment rules make LLCs a great option,2026-03-17T06:00:00+00:00,other,politics,neutral,0,"Le texte ne fournit pas d'informations directes sur les marchés agricoles, mais évoque des règles de paiement de la FSA qui pourraient avoir un impact sur la gestion des fermes. Cela n'affecte pas directement les prix des matières premières agricoles. Les traders doivent rester vigilants sur les évolutions réglementaires qui pourraient influencer les décisions de production et de commercialisation.",Aucun impact direct sur les prix des matières premières agricoles.,"Les prix devraient rester stables à court terme, en attendant des informations plus précises sur les règles de paiement de la FSA.",1,none,
FarmProgress_US,grains,https://www.farmprogress.com/farm-life/wildfire-fallout-producer-losses-go-deeper-than-cattle-pastureland,"Wildfire fallout: Producer losses go deeper than cattle, pastureland",2026-03-17T06:00:00+00:00,other,weather,neutral,0,"Les incendies de forêt dans le Sud-Ouest des États-Unis n'ont pas d'impact direct sur les marchés des céréales. Cependant, les pertes pour les éleveurs de bétail pourraient avoir des répercussions sur la demande de fourrage et les prix des produits animaux. Les traders doivent surveiller les développements dans le secteur de l'élevage pour anticiper les éventuelles conséquences sur les marchés agricoles.","Aucun impact direct sur les prix des céréales, mais les pertes pour les éleveurs pourraient avoir des effets à long terme sur les marchés agricoles.","Les prix des céréales devraient rester stables à court terme, mais les traders doivent rester vigilants face aux éventuels développements dans le secteur de l'élevage.",1,none,
TheProducer_Canada,grains,https://www.producer.com/news/conservation-easements-with-limits-have-appeal/,Conservation easements with limits have appeal,2026-03-16T21:52:29+00:00,other,politics,neutral,0,"Le texte ne fournit pas d'informations directes sur les marchés agricoles ou les prix des grains. Les conservation easements sont liés à l'utilisation des terres et à la conservation de l'environnement, mais sans impact direct sur les prix des matières premières agricoles.",Aucun impact direct sur les prix,Stable à court terme,3,info,war
TheProducer_Canada,grains,https://www.producer.com/good-bad-ugly/the-good-bad-ugly-1208/,"The Good, Bad & Ugly",2026-03-16T21:41:41+00:00,other,trade,bullish,1,"Les fonds ont augmenté leur position longue sur les matières premières agricoles, ce qui pourrait entraîner une hausse des prix. Les investisseurs ont acheté un filet de 33 815 contrats, portant leur position nette à 95 162 contrats. Cela pourrait avoir un impact positif sur les prix à court terme.","L'impact direct sur les prix pourrait être une hausse de 2-4% à court terme, en raison de l'augmentation de la demande et de la position longue des fonds.","Les prix pourraient rester haussiers dans les deux semaines à venir, en raison de la position longue des fonds et de la demande accrue.",2,info,
TheProducer_Canada,grains,https://www.producer.com/news/taking-a-look-at-the-spring-forecast/,Taking a look at the spring forecast,2026-03-16T21:13:55+00:00,other,weather,neutral,0,"Le texte ne fournit pas d'informations spécifiques sur les matières premières agricoles, mais évoque une prévision météorologique pour les prochains mois. Cela pourrait avoir un impact sur les rendements et les prix des grains à l'avenir. Les traders devraient surveiller de près les prévisions météorologiques pour anticiper les tendances du marché.","Pas d'impact direct sur les prix pour le moment, mais une surveillance étroite des prévisions météorologiques est nécessaire.","Les prix devraient rester stables à court terme, mais une surveillance étroite des prévisions météorologiques est nécessaire pour anticiper les tendances du marché.",1,none,
TheProducer_Canada,grains,https://www.producer.com/livestock/the-western-producer-livestock-report-march-19-2026/,"The Western Producer Livestock Report – March 19, 2026",2026-03-16T21:12:09+00:00,other,other,neutral,0,"Le texte ne fournit pas d'informations sur les marchés des grains, mais plutôt sur les prix du porc, du bison et de l'agneau. Il n'y a donc pas d'impact direct sur les prix des grains. Les traders de grains devraient se concentrer sur d'autres facteurs pour prendre leurs décisions.",Aucun impact direct sur les prix des grains.,"Les prix des grains devraient rester stables dans les prochaines semaines, en l'absence de facteurs perturbateurs majeurs.",0,none,
TheProducer_Canada,grains,https://www.producer.com/livestock/canfax-cattle-market-report-march-19-2026/,"Canfax cattle market report – March 19, 2026",2026-03-16T21:10:50+00:00,other,other,neutral,0,"Le rapport de marché Canfax sur le bétail ne fournit pas d'informations directes sur les grains. Cependant, il peut avoir un impact indirect sur les prix des grains en fonction de la demande de fourrage pour le bétail. Les traders doivent surveiller les tendances du marché du bétail pour anticiper les variations de la demande de grains.","Aucun impact direct sur les prix des grains, mais les traders doivent surveiller les tendances du marché du bétail.","Les prix des grains pourraient rester stables à court terme, mais les traders doivent rester vigilants face aux tendances du marché du bétail.",0,none,
